{
  "$schema":"https://json-schema.org/draft/2020-12/schema","$id":"https://softdata-api.local/schemas/finance/development_finance_institutions.schema.json","title":"Nigeria Development Finance Institutions","type":"array","minItems":8,"maxItems":8,"uniqueItems":true,
  "items":{"type":"object","additionalProperties":false,"required":["id","name","country_code"],"properties":{"id":{"type":"string","pattern":"^[a-z0-9]+(?:-[a-z0-9]+)+$"},"name":{"type":"string","minLength":1},"website_url":{"type":"string","format":"uri","pattern":"^https://"},"logo_url":{"type":"string","pattern":"^/v1/assets/financial-institutions/ng/development-finance/[a-z0-9]+(?:-[a-z0-9]+)+\\.png$"},"country_code":{"type":"string","const":"NG"}}}
}
