[
  {"id":"abbey-mortgage-bank","name":"Abbey Mortgage Bank","website_url":"https://abbeybank.com/","logo_url":"/v1/assets/financial-institutions/ng/primary-mortgage/abbey-mortgage-bank.png","country_code":"NG"},
  {"id":"adamawa-mortgage-bank","name":"Adamawa Mortgage Bank Limited","website_url":"https://adamawamortgagebank.com.ng/pages/home","logo_url":"/v1/assets/financial-institutions/ng/primary-mortgage/adamawa-mortgage-bank.png","country_code":"NG"},
  {"id":"ag-homes","name":"AG Homes","website_url":"https://www.agmortgagebankplc.com/","logo_url":"/v1/assets/financial-institutions/ng/primary-mortgage/ag-homes.png","country_code":"NG"},
  {"id":"brent-skyfield-savings","name":"Brent (Skyfield) Savings","website_url":"https://brentng.com/","logo_url":"/v1/assets/financial-institutions/ng/primary-mortgage/brent-skyfield-savings.png","country_code":"NG"},
  {"id":"centage-savings-loans","name":"Centage Savings & Loans","website_url":"https://centagesavingsltd.com/","logo_url":"/v1/assets/financial-institutions/ng/primary-mortgage/centage-savings-loans.png","country_code":"NG"},
  {"id":"city-code","name":"City Code","website_url":"https://citycodemortgagebank.com/","logo_url":"/v1/assets/financial-institutions/ng/primary-mortgage/city-code.png","country_code":"NG"},
  {"id":"coop-mortgage-bank","name":"Cooperative Mortgage Bank Limited","website_url":"https://cmbankng.com/","logo_url":"/v1/assets/financial-institutions/ng/primary-mortgage/coop-mortgage-bank.png","country_code":"NG"},
  {"id":"delta-trust-mortgage-finance","name":"Delta Trust Mortgage Finance Limited","website_url":"https://deltatrustmb.com/","logo_url":"/v1/assets/financial-institutions/ng/primary-mortgage/delta-trust-mortgage-finance.png","country_code":"NG"},
  {"id":"fha-homes","name":"FHA Homes Ltd.","website_url":"https://www.fhamortgage.gov.ng/","logo_url":"/v1/assets/financial-institutions/ng/primary-mortgage/fha-homes.png","country_code":"NG"},
  {"id":"first-generation-homes","name":"First Generation Homes","website_url":"https://fgmb.com.ng/","logo_url":"/v1/assets/financial-institutions/ng/primary-mortgage/first-generation-homes.png","country_code":"NG"},
  {"id":"firsttrust-mortgage-bank","name":"FirstTrust Mortgage Bank Plc","website_url":"https://www.ftmortgagebankplc.com/index","logo_url":"/v1/assets/financial-institutions/ng/primary-mortgage/firsttrust-mortgage-bank.png","country_code":"NG"},
  {"id":"gateway-savings","name":"Gateway Savings","website_url":"https://gatewaymortgagebankng.com/","logo_url":"/v1/assets/financial-institutions/ng/primary-mortgage/gateway-savings.png","country_code":"NG"},
  {"id":"global-trust","name":"Global Trust","website_url":"https://mygtmb.com/","logo_url":"/v1/assets/financial-institutions/ng/primary-mortgage/global-trust.png","country_code":"NG"},
  {"id":"haggai-mortgage-bank","name":"Haggai Mortgage Bank","website_url":"https://haggaibank.com/","logo_url":"/v1/assets/financial-institutions/ng/primary-mortgage/haggai-mortgage-bank.png","country_code":"NG"},
  {"id":"home-base-mortgage","name":"Home-Base Mortgage","website_url":"https://homebasebank.com/","logo_url":"/v1/assets/financial-institutions/ng/primary-mortgage/home-base-mortgage.png","country_code":"NG"},
  {"id":"akwa-savings","name":"Ibom Mortgage Bank","website_url":"https://ibommortgagebank.com/","logo_url":"/v1/assets/financial-institutions/ng/primary-mortgage/akwa-savings.png","country_code":"NG"},
  {"id":"imperial-homes","name":"Imperial Homes","website_url":"https://www.imperialmortgagebank.com/","logo_url":"/v1/assets/financial-institutions/ng/primary-mortgage/imperial-homes.png","country_code":"NG"},
  {"id":"infinity-trust","name":"Infinity Trust","website_url":"https://www.infinitytrustmortgagebank.com/","logo_url":"/v1/assets/financial-institutions/ng/primary-mortgage/infinity-trust.png","country_code":"NG"},
  {"id":"jigawa-savings-loans","name":"Jigawa Savings & Loans","website_url":"https://www.jigawasavingsandloans.com.ng/","logo_url":"/v1/assets/financial-institutions/ng/primary-mortgage/jigawa-savings-loans.png","country_code":"NG"},
  {"id":"jubilee-life-mortgage-bank","name":"Jubilee-Life Mortgage Bank","website_url":"https://jubileelifeng.com/","logo_url":"/v1/assets/financial-institutions/ng/primary-mortgage/jubilee-life-mortgage-bank.png","country_code":"NG"},
  {"id":"kebbi-state-homes","name":"Kebbi State Homes","website_url":"https://kebbihomesavings.com/","logo_url":"/v1/assets/financial-institutions/ng/primary-mortgage/kebbi-state-homes.png","country_code":"NG"},
  {"id":"lagos-building-investment","name":"Lagos Building & Investment","website_url":"https://lbicplc.com/","logo_url":"/v1/assets/financial-institutions/ng/primary-mortgage/lagos-building-investment.png","country_code":"NG"},
  {"id":"living-trust-mortgage-bank","name":"Living Trust Mortgage Bank Plc","website_url":"https://www.livingtrustng.com/","logo_url":"/v1/assets/financial-institutions/ng/primary-mortgage/living-trust-mortgage-bank.png","country_code":"NG"},
  {"id":"mayfresh-mortgage-bank","name":"Mayfresh Mortgage Bank","website_url":"https://mayfreshmb.com/","logo_url":"/v1/assets/financial-institutions/ng/primary-mortgage/mayfresh-mortgage-bank.png","country_code":"NG"},
  {"id":"mgsl-mortgage-bank","name":"MGSL Mortgage Bank","website_url":"https://mgslmortgbank.com/","logo_url":"/v1/assets/financial-institutions/ng/primary-mortgage/mgsl-mortgage-bank.png","country_code":"NG"},
  {"id":"mutual-alliance","name":"Mutual Alliance","website_url":"https://mutualalliancebank.com/","logo_url":"/v1/assets/financial-institutions/ng/primary-mortgage/mutual-alliance.png","country_code":"NG"},
  {"id":"nigeria-police-mortgage-bank","name":"Nigeria Police Mortgage Bank","website_url":"https://www.nigeriapolicemortgagebank.com/","logo_url":"/v1/assets/financial-institutions/ng/primary-mortgage/nigeria-police-mortgage-bank.png","country_code":"NG"},
  {"id":"platinum-mortgage-bank","name":"Platinum Mortgage Bank","website_url":"https://pmbl-ng.com/","logo_url":"/v1/assets/financial-institutions/ng/primary-mortgage/platinum-mortgage-bank.png","country_code":"NG"},
  {"id":"prudential-mortgage-bank","name":"Prudential Mortgage Bank Limited","website_url":"https://prudential.ng/","logo_url":"/v1/assets/financial-institutions/ng/primary-mortgage/prudential-mortgage-bank.png","country_code":"NG"},
  {"id":"refuge-mortgage-bank","name":"Refuge Mortgage Bank Limited","website_url":"https://refugebank.com.ng/","logo_url":"/v1/assets/financial-institutions/ng/primary-mortgage/refuge-mortgage-bank.png","country_code":"NG"},
  {"id":"stb-mortgage-bank","name":"STB Mortgage Bank Limited","website_url":"https://www.stbsociety.com/","logo_url":"/v1/assets/financial-institutions/ng/primary-mortgage/stb-mortgage-bank.png","country_code":"NG"}
]
